S. No,Br. No ,Br. Date ,Recid,Main_Category,Passed_Category,Contractor_name,Description_Kan,Description_Eng,Bill Pass Date,Bill Pass Amt,Paid Date,Paid Amt
569,36,08-Apr-15,67311,Capital-Civil,Civil,Bilebal Sanjay Gurappa,"EAqÉAmï £ÀA.21755, ºÀÄ.«.ªÁqÀđ £ÀA.66gÀ ²ªÀ£ÁUÀ §qÁªÀuÉ ¸ÀAAiÀÄÄPÀÛ PÀ£ÁđlPÀ PÁ®¤ ªÀgÉUÉ ºÁUÀÆ UÀuÉĂ±À PÁ®¤ 11£ÉĂ PÁæ¸À¤AzÀ 15£ÉĂ PÁæ¸ÀªÀgÉUÉ gÀ¸ÉÛUÀ½UÉ RrĂPÀgÀt ªÀÄvÀÄÛ ²æĂgÁªÀÄ PÁ®¤ ºÀwÛgÀ ¹.r.PÀlÄÖªÀÅzÀÄ.","Regadring Black top road works and Drain works at Shivanag Badavane,Shri Ram Colony CD works in ward No :65",15-Apr-15,131523,14-May-15,131523
570,119,13-Apr-15,68462,Capital-Civil,Civil,Dayagodi Umesh,ºÀÄ.«.ªÁqÀđ.£ÀA.32gÀ°è PÁqÀ¹zÉƯĂ±ÀégÀ PÁ¯ÉÆĂ¤ ºÁUÀÆ zÀAiÀiÁ£ÀAzÀ PÁ¯ÉÆĂ¤AiÀÄ°è AiÀÄÄ.f.r ¯ÉÊ£ï ºÁQ ZÉĂA§gï PÀlÄÖªÀzÀÄ. EAqÉAl £ÀA-21775,Regarding UGD works at Kadsiddeshwar coloni in ward no : 32,20-Apr-15,495461,14-May-15,495461
571,272,18-Apr-15,68461,Capital-Civil,Civil,Dayagodi Umesh,ºÀÄ.«.ªÁqÀđ.£ÀA32gÀ°è £ÁUÀ±ÉnÖPÉÆ¥Àà ¸ÀtÚ NtÂ ±ÁåArĂ¯ï D±ÀæªÀÄzÀ ªÀÄÄA¢£À gÀ¸ÉÛAiÀÄ°è ºÁUÀÆ zÀAiÀiÁ£ÀAzÀ PÁ¯ÉÆĂ¤AiÀÄ°è Dgï ¹ ¹ UÀmÁgÀ ªÀÄvÀÄÛ ¹.r. ¤«Äđ¸ÀÄªÀzÀÄ. EAqÉAl £ÀA21776,Regarding RCC Drain works at Nagashettikoppa in ward no : 32,23-Apr-15,667423,14-May-15,667423
572,407,23-Apr-15,71112,Capital-Civil,Civil,Nalbund A H,ºÀÄ.«.ªÁqÀđ.£ÀA.44gÀ ªÉÆĂ«Ä£À ¥Áèl 3£ÉĂ PÁæ¸ï PÀÄ¸ÀÄUÀ®è ªÀÄ£É ºÀwÛgÀ M¼ÀZÀgÀAr ºÁPÀÄªÀÅzÀÄ.,Regarding UGD Line work at Momin flot ward no.44,27-Apr-15,53830,14-May-15,53830
573,141,15-Apr-15,52585,Capital-Civil,Civil,Davalnavar M.I.,zsÁgÀªÁqÀ «¨sÁUÀzÀ «¨ÁUÀzÀ ªÀ®AiÀÄ PÀZÉĂj £ÀA 12 ªÁqÀđ £ÀA. 16 gÀ ®QëöäĂ¹AUÀ£ÀPÉĂj ¹zÀƯgÁªÉÄĂ±ÀégÀ UÀÄr gÀ¸ÉÛAiÀÄ°è vÀqÉUÉÆĂqÉ ¤«Äđ¸ÀÄªÀÅzÀÄ.,Construction of Retaining wall along with siddarameshwar temple at Laxmisingankeri in ward No. 16 of Dharwad.,27-Apr-15,2490380,14-May-15,2490380
574,405,23-Apr-15,66260,Capital-Civil,Civil,Magadum P.A.,ªÁqÀđ £ÀA 33 gÀ ±ÁSÁA§j §qÁªÀuÉAiÀÄ°è Dgï.¹.¹ vÉgÉzÀ ZÀgÀAr PÀlÄÖªÀÅzÀÄ.,Regarding Open Drain work At Shakhambari Badavane. in ward no 33,30-Apr-15,94690,14-May-15,94690
575,661,29-Apr-15,67849,Capital-Civil,Civil,A D Haladi,"zsÁgÀªÁqÀ «¨ÁUÀzÀ ªÀ®AiÀÄ PÀZÉĂj £ÀA 02 ªÁqÀđ £ÀA 06 gÀ°è £ÀzÁ¥sÀ NtÂ, PÀÄA¨ÁgÀ NtÂ, ªÀÄºÁAvÀ£ÀUÀgÀ 3£ÉĂ PÁæ¸ï, (¨sÁUÀ±ÀB) ºÁUÀÆ ºÀ¼ÉUÀqÀAUÀ gÀ¸ÉÛAiÀÄ°è (±Á¹ÛçªÀÄoÀgÀªÀgÀ ªÀÄ£ÉAiÀÄ §½) vÉgÉzÀ ZÀgÀAr ¤ªÀiÁđt,ªÀÄvÀÄÛ fgÀ° ¥ÁèlzÀ°è AiÀÄÄfr, ¥ÀvÉæĂ±ÀégÀ £ÀUÀgÀzÀ°è gÀ¸ÉÛ C©üªÀÈ¢Ư PÁªÀÄUÁj. (EAqÉĂ£ïÖ £ÀA. 21720)","Regarding Road Development Works and Drain works at Nadaf oni,Mahanth Nagar3rd Cross, Jirali Plot road in ward No : 06",07-May-15,1696221,14-May-15,1696221
576,10797,31-Mar-15,67898,Capital-Civil,Budgeted Works 2014-15,Hanchin V B,ºÀÄ§â½èAiÀÄ PÉÆĂlđ JzÀÄgÀUÉ EgÀÄªÀ ¥Á°PÉ MqÉvÀ£ÀzÀ ¹nJ¸ï £ÀA 173 gÀ°è ªÀiÁf ªÀÄÄRåªÀÄAwæUÀ¼ÀÄ ²æĂ J¸ï Dgï ¨ÉÆĂªÀiÁä¬Ä EªÀgÀ PÀAa£À ¥ÀÄvÀÜ½ C¼ÀªÀr¸ÀÄªÀÅzÀÄ E.£ÀA-22011.,Regarding Statue work At Hubli Division Court Opp,04-May-15,424344,18-May-15,424344
577,656,29-Apr-15,69805,Capital-Civil,Civil,Palkar Shivayogi Channappa,zsÁgÀªÁqÀ «¨ÁUÀzÀ ªÀ®AiÀÄ PÀZÉĂj £ÀA 12 ªÁqÀđ £ÀA.22gÀ UÁA¢ü£ÀUÀgÀ ²æĂ PÁA§¼É ªÀÄ£É ºÀwÛgÀ vÉgÉzÀ ZÀgÀAr ¤«Äđ¸ÀÄªÀÅzÀÄ.(EAqÉĂ£ïÖ £ÀA.25694),Regarding Drain work at Gandhinagar in ward no.22 of Dharwad.,07-May-15,189276,20-May-15,189276
578,696,02-May-15,69236,Capital-Civil,Electrical Works,Durga Electricals Prop : Parashuram D Pujar,ºÀÄ.«.ªÁ.£ÀA.47 gÀ°è §gÀÄªÀ alUÀÄ¦à D¸ÀàvÉæ DªÀgÀtzÀ°èAiÀÄ ªÀiÁ£Àå ¸ÀA¸Àvï ¸ÀzÀ¸ÀågÀ PÀZÉĂjUÉ ºÉÆ¸ÀzÁV «zÀÄåwÛPÀgÀt ªÀiÁqÀÄªÀ PÀÄjvÀÄ.,Electrical works in Chitguppi Hospital in members office of Hubli divison.,07-May-15,71373,20-May-15,71373
579,1000,16-May-15,69594,Capital-Civil,Civil,Akki Prakash Gurubasappa,ºÀÄ.«.ªÁqÀđ £ÀA -38 ªÀÄAdÄ£ÁxÀ£ÀUÀgÀ GzÁå£ÀªÀ£ÀPÉ̀ ZÉÊ£À°APÀ ªÉÄĂ±À C¼ÀªÀr¸ÀÄªÀÅzÀÄ.(²æĂ. ªÀiÁgÀÄw UÀÄr JzÀÄjUÉ)EAqÉAl £ÀA:-21820,Regarding Gardens works at Manjunath Nagar in ward no : 38,21-May-15,304676,25-May-15,304676
580,1113,20-May-15,70678,Capital-Civil,Civil,Malagimani Ashok M,ºÀÄ.«.ªÁqÀđ.40gÀ £ÀA¢¤£ÀUÀgÀ¢AzÀ D£ÀAzÀ£ÀUÀgÀ £Á¯ÁªÀgÉUÉ Dgï.¹.¹ vÉgÉzÀ ZÀgÀAr ¤ªÀiÁđt ªÀiÁqÀÄªÀÅzÀÄ.,Regarding Open Drain Work at Nandini Nagar ward in.40,23-May-15,969399,25-May-15,969399
581,1126,21-May-15,67973,Capital-Civil,Civil,Naragund S.M.,"ºÀÄ.«.zÀ"".ªÁqÀđ.£ÀA.30 ¨ÉĂAUÉĂjAiÀÄ°èAiÀÄ ¥ÀAZÀÄ QgÁtÂ ¸ÉÆÖĂgÀ¢AzÀ SÁ¢üUÁæªÉÆĂzÉÆåĂUÀzÀ ªÀgÀUÉ ºÁUÀÆ £ÀgÀUÀÄAzÀ PÁA¥ÉèPÀ́¢AzÀ ®PÀëöät ºÉÆ¸ÀªÀÄ¤AiÀÄªÀgÀ ªÀÄ£ÉAiÀÄªÀgÀUÉ Dgï¹ ¹ UÀmÁgÀ ¤«Äđ¸ÀÄªÀzÀÄ  EAqÉAl £ÀA21779",Regarding RCC Drain works at Bengeri panchu Kirani store in ward no : 30,26-May-15,1642319,26-May-15,1642319
582,880,12-May-15,53231,Capital-Civil,Budgeted Works 2012-13,Davalnavar M.I.,zsÁgÀªÁqÀ «¨ÁUÀzÀ ªÀ®AiÀÄ PÀZÉĂj £ÀA 01 ªÁqÀđ £ÀA 01 gÀ PÉ.¹.r. ªÀÈvÀÛzÀ°è ²æĂ ¯Á®§ºÁzÀÆƯgÀ ±Á¹Ûç ªÀÄÆwđ PÀÆr¸À®Ä ¥ÉqÉ¸ÀÖ¯ï ¤«Äđ¸ÀÄªÀÅzÀÄ.,Regarding Civil Structures Statues works in ward No 01at KCD Circle Shri Lalbahaddur Shastri Statue,19-May-15,102893,08-Jun-15,102893
583,253,18-Apr-15,69394,Capital-Civil,Budgeted Works 2014-15,Cosmic Micro Systems Pvt. Ltd Bangalore,ºÀÄ.«.ªÁ.£ÀA. 47 gÀ°è ºÉÆ¸ÀzÁV PÀnÖ¹zÀ ºÉÆ¸À alUÀÄ¦à D¸ÀàvÉæAiÀÄ D¥sÀgÉĂ±À£ï xÉĂlgï (±À¸ÀÛç aQÛvÁ́) ºÁUÀÆ ºÉjUÉ WÀlPÀzÀ°è AiÀÄÄ.¦.J¸ï. C¼ÀªÀr¸ÀÄªÀ PÀÄjvÀÄ.,Supplying and fixing of UPS in Newly built chitguppi hospital operation theatre and Labour room of hubli division,11-May-15,98000,08-Jun-15,98000
584,879,12-May-15,69700,Capital-Civil,Budgeted Works 2014-15,Davalnavar M.I.,zsÁgÀªÁqÀ «¨ÁUÀzÀ ªÀ®AiÀÄ PÀZÉĂj £ÀA 01 ªÁqÀđ £ÀA 13gÀ ¹éªÀÄäAUï ¥ÀÆ® ¸ÀÄvÀÛ®Æ UÀæ¦àAUï ¸À®ÄªÁV fL ¥ÉÊ¥À C¼ÀªÀr¸ÀÄªÀÅzÀÄ,Regarding providing of GI pipe around swimming pool in w.no 13 of  Dharwad Division,19-May-15,44922,08-Jun-15,44922
585,882,12-May-15,70253,Capital-Civil,Budgeted Works 2014-15,Davalnavar M.I.,zsÁgÀªÁqÀ «¨ÁUÀzÀ ªÀ®AiÀÄ PÀZÉĂj £ÀA 01 ªÁqÀđ £ÀA 13gÀ°è ¯Á®§ºÁzÀÆƯgÀ ±Á¹Ûç ªÀÄÆwđ ¸ÀÄvÀÛ®Æ Væ¯ï ºÁQ ªÉÄnÖ®ÄUÀ¼À ¤ªÀiÁđt. (EAqÉĂ£ïÖ £ÀA. 23867),Regarding Statue Work at Dharwad Division ward no.13,19-May-15,229543,08-Jun-15,229543
586,928,15-May-15,70959,Capital-Civil,Budgeted Works 2014-15,Kyatannavar R.P.,ºÀÄ. «. ªÁ £ÀA: 39gÀ D£ÀAzÀ£ÀUÀgÀ gÉÆĂqÀ ºÁUÀÆ ¹zÁ̃gÀÆqsÀ£ÀUÀgÀ ªÀÄÄRågÀ¸ÉÛUÀ½UÉ Rr ¥ÁåZÀ ªÀiÁqÀÄªÀÅzÀÄ.,Regarding Road Patch work at Anand Nagar road & Siddharoodh Nagar in ward no:39,21-May-15,33822,08-Jun-15,33822
587,1441,01-Jun-15,71669,Capital-Civil,Budgeted Works 2014-15,"Colour Vibrations, Bangalore",PÀ£ÀéPÉĂ±À£ï ¸ÉAlgïzÀ°è ¸ÉÖĂeï VæĂqï ªÀÄvÀÄÛ ¥Áå©æĂPÉ±À£ï ªÀPÀđ ªÀiÁrgÀÄªÀÅzÀÄ.,providing stage grid and other fabrication works for convention centere hubli,02-Jun-15,630889,08-Jun-15,630889
588,1398,30-May-15,71356,Capital-Civil,Budgeted Works 2014-15,Chalawadi Hulagappa Nagappa,"EAqÉAmï £ÀA.26670, ºÀÄ.«.ªÁqÀđ.£ÀA41gÀ ºÉUÉÎĂj ¯ÉÆĂPÀÄgÀ zÁåªÀÄªÀé£À UÀÄrAiÀÄ ¸ÀªÀÄÄzÁAiÀÄ ¨sÀªÀ£ÀzÀ ªÀÄÄAzÀÄªÀgÉzÀ PÁªÀÄUÁjAiÀÄ£ÀÄß PÉÊUÉÆ¼ÀÄîªÀzÀÄ.",Regarding Building work at Heggeri in ward no.41,06-Jun-15,246849,08-Jun-15,246849
589,1437,30-May-15,68442,Capital-Civil,Budgeted Works 2014-15,Raju S.R.,"EAqÉAmï £ÀA.23232, ºÀÄ.«.ªÁqÀđ £ÀA 59 gÀ EArgÁ£ÀUÀgÀ »A¢£À £Á¯ÁPÉ̀ vÀqÉUÉÆĂqÉ ¤«Äđ¸ÀÄªÀzÀÄ.",Regarding Nala work  At Indira nagar in ward no 59,08-Jun-15,143786,08-Jun-15,143786
590,1458,02-Jun-15,66841,Capital-Civil,Budgeted Works 2014-15,Raju S.R.,"EAqÉAmï £ÀA.21764, ºÀÄ.«.ªÁqÀđ £ÀA 59gÀ PÀQđ£Á¯Á ¸ÁèlgÀ ºË¸À ºÀwÛgÀ £Á¯ÁvÀqÉUÉÆĂqÉ ¤«Äđ¸ÀÄªÀÅzÀÄ.",Regardind Nala Work at Karkinala Slater House Ward No 59.,08-Jun-15,192031,08-Jun-15,192031
591,1408,30-May-15,72080,Capital-Civil,Budgeted Works 2014-15,"Colour Vibrations, Bangalore","ºÀÄ.«.ªÁqÀđ.£ÀA.45gÀ PÀ£Éé£ï±À£ï ¸ÉAgÀ ¸À¨sÁAUÀtzÀ DªÀgÀtzÀ°è PÁgÀAfUÀ¼À ¤ªÀiÁđt, UÉÆĂqÉUÀ¼À ªÉÄĂ¯É ªÁlgï ¥ÉĂAn¤AzÀ PÀ¯ÁPÀÈwUÀ¼À£ÀÄß ªÀiÁqÀÄªÀÅzÀÄ.",Regarding Building work at Hubli Division in ward no.45,08-Jun-15,1399994,08-Jun-15,1399994
592,1084,19-May-15,69991,Capital-Civil,Civil,Khaza Hussain A. K.,"zsÁgÀªÁqÀ «¨ÁUÀ ªÀ®AiÀÄ PÀZÉĂj £ÀA 02 ªÁqÀđ £ÀA 06 gÀ°è ¥ÉAqÁgÀ NtÂAiÀÄ°è AiÀÄÄfr ¯ÉÊ£ï C¼ÀªÀr¸ÀÄªÀzÀÄ ªÀÄvÀÄÛ ZÉĂA§g PÀlÄÖªÀzÀÄ, ºÁUÀÆ PÀÄA¨ÁgÀ FtÂAiÀÄ°è ªÁlgï ¸À¥ÉèöÊ mÉæAZï j¸ÉÆÖĂgÉ±À£ï ªÀiÁqÀÄªÀzÀÄ.","Regarding UGD Line & Water Supply work At Pendar Oni, Kumbar Oni. in ward no 6",21-May-15,76294,08-Jun-15,76294
593,968,16-May-15,71093,Capital-Civil,Civil,Shrinivas N Mane,ºÀÄ.«.ªÁqÀđ £ÀA 25 gÀ ¸Á¬Ä£ÀUÀgÀ §¸ï gÀÆl£À°è M¼ÀZÀgÀAr PÉÆ¼ÀªÉ ºÁPÀÄªÀzÀÄ ªÀÄvÀÄÛ ZÉĂA§gÀ zÀÄgÀ¹Ü ªÀiÁqÀÄªÀzÀÄ.,Regarding  UGD Line work At Saingar Bus Root. in ward no 25,30-May-15,81000,08-Jun-15,81000
594,1155,22-May-15,71092,Capital-Civil,Civil,Shrinivas N Mane,ºÀÄ.«.ªÁqÀđ £ÀA 24 gÀ ºÀÄ§â½î «. ªÁqÀđ £ÀA 23 gÀ £ÀªÀ£ÀUÀgÀ 9£ÉĂ PÁæ¸ï ºÁUÀÆ 10£ÉĂ CqÀØgÀ¸ÉÛ qÁ\\ ¸ÀAvÉÆĂµÀ ºÀ£ÀÄªÀÄ gÉrØ ªÀÄ£É £ÀA - 138 jAzÀ §£À±ÀAPÀj zÉĂ« PÀÈ¥Á ªÀgÉUÉ M¼ÀZÀgÀAr PÉÆ¼ÀªÉ ªÀiÁUÀđ ºÁUÀÆ ºÉÆ¸À ZÉĂA§gÀ ¤ªÀiÁđt ªÀiÁqÀÄªÀzÀÄ.,Regarding GUD Line work At Navangar 9th Cross & 10 th Cross Near Dr Santosh Hanum  Reddi Residence House nM 138 To Banashakankeri Devi Krupa. in ward no 23.,30-May-15,48000,08-Jun-15,48000
595,967,16-May-15,71105,Capital-Civil,Civil,Shrinivas N Mane,ºÀÄ.«.ªÁqÀđ £ÀA 23 gÀ ¥ÀAZÁPÀëj £ÀUÀgÀ PÀvÀ£À½ ªÀÄ£É ªÀiÁUÀđ ªÀÄvÀÄÛ PÉ.JZï.©. PÁ¯ÉÆ¤AiÀÄ°è ºÉÆ¸À ZÉĂA§gÀ ¤ªÀiÁđt ºÁUÀÆ  M¼ÀZÀgÀAr ZÉĂA§gÀUÀ¼À zÀÄgÀ¹Ü ªÀiÁqÀÄªÀzÀÄ,Regarding GUD Line work At Panchakshri nagar Kathnali Residence house no : 546 & K.H.B. Colony in ward no 23,30-May-15,32507,08-Jun-15,32507
596,970,16-May-15,71117,Capital-Civil,Civil,Narendra Veeranna Siddappa,ºÀÄ.«.ªÁqÀđ £ÀA 24 gÀ CªÀÄgÀUÉÆĂ¼À UÁæªÀÄzÀ ¸ÉÖĂµÀ£À gÀ¸ÉÛ ºÁUÀÆ £ÀªÀ£ÀUÀgÀ PÉªÉA¥ÀÄ gÀ¸ÉÛUÀ¼À°è M¼ÀZÀgÀAr ZÉĂA§gÀUÀ¼À zÀÄgÀ¹Ü ºÁUÀÆ PÉÆ¼ÀªÉ ªÀiÁUÀđ zÀÄgÀ¹Ü ªÀiÁqÀÄªÀzÀÄ.,"Regarding UGD Line work At Amargol Gram, Station Road & Navan Nagar Kuvempu Road in ward no 24",30-May-15,26000,08-Jun-15,26000
597,1318,28-May-15,69926,Capital-Civil,Civil,Kyatannavar R.P.,ºÀÄ.«.ªÁ.£ÀA.24gÀ CzsÁå¥ÀPÀ£ÀUÀgÀ 1£ÉĂ CqÀØgÀ¸ÉÛ¬ÄAzÀ 3£ÉĂ CqÀØgÀ¸ÉÛªÀgÉUÉ M¼ÀZÀgÀAr PÉÆ¼ÀªÉ ºÁPÀÄªÀÅzÀÄ ºÁUÀÆ ZÉA§gÀ PÀlÄÖªÀÅzÀÄ.,Regarding UGD line work at Adhyapaka Nagar in ward no.24,30-May-15,361006,08-Jun-15,361006
598,1181,23-May-15,68600,Capital-Civil,Civil,Magadum P.A.,ºÀÄ§â½î «¨sÁUÀzÀ  ªÁqÀđ £ÀA. 28gÀ C±ÉÆĂPÀ£ÀUÀgÀ gÉÊ¯Éé CAqÀgÀ ¥Á¸À ºÀwÛgÀ Dgï.¹.¹. vÉgÉzÀ ZÀgÀAr ¤ªÀiÁđt.   EAqÉAl £ÀA:-21859,Regarding RCC Drain works at Ashok Nagar in ward no : 28,30-May-15,198766,08-Jun-15,198766
599,1379,29-May-15,71119,Capital-Civil,Civil,Narendra Veeranna Siddappa,ºÀÄ.«.ªÁqÀđ £ÀA 24 gÀ CªÀÄgÀUÉÆĂ¼À zÀÄAr §¸ÀªÀtÚ UÀÄrAiÀÄ ºÀwÛgÀ M¼ÀZÀgÀAr PÉÆ¼ÀªÉ ªÀiÁUÀđ ºÁUÀÆ M¼ÀZÀgÀAr ZÉĂA§gÀ zÀÄgÀ¹Ü ªÀiÁqÀÄªÀzÀÄ.,Regarding UGD Line work At Near Amargol Dhundi Basavanna Gudi.in ward no 24,30-May-15,14000,08-Jun-15,14000
600,1384,29-May-15,71111,Capital-Civil,Civil,Narendra Veeranna Siddappa,ºÀÄ.«.ªÁqÀđ £ÀA 23gÀ ¥ÀAZÁPÀëj£ÀUÀgÀ ªÀÄvÀÄÛ ²ªÁ£ÀAzÀ £ÀUÀgÀ. UÁªÀÄ£ÀUÀnÖ ªÀÄÄRågÀ¸ÉÛ  M¼ÀZÀgÀAr ZÉĂA§gÀUÀ¼À zÀÄgÀ¹Ü ªÀiÁr PÀªÀgÀ ºÁPÀÄªÀzÀÄ.,Regarding UGD Line work At Panchakshri Naghar & Shivanand Nagar. Gamangatti Main Road  in ward no 23,30-May-15,26410,08-Jun-15,26410
601,1381,29-May-15,71123,Capital-Civil,Civil,Narendra Veeranna Siddappa,ºÀÄ.«.ªÁqÀđ £ÀA 24 gÀ CªÀÄgÀUÉÆĂ¼À ªÀÄvÀÄÛ £ÀªÀ£ÀUÀgÀ J¯ï.F.f. 6£ÉĂ ªÀÄÄRågÀ¸ÉÛUÉ ºÉÆ¸À ZÉĂA§gÀ ¤ªÀiÁđt ºÁUÀÆ PÀªÀgÀ ºÁPÀÄªÀzÀÄ.,Regarding  Drain work At Amargol & Navangar lIG 6th Main Road. in ward no 24,30-May-15,20000,08-Jun-15,20000
602,1380,29-May-15,71089,Capital-Civil,Civil,Narendra Veeranna Siddappa,"ºÀÄ.«.ªÁqÀđ £ÀA 24 PÀ£ÁđlPÀ ªÀÈvÀÛ, £ÀªÀ£ÀUÀgÀ ºÁUÀÆ ±ÁAvÀ£ÀUÀgÀzÀ°è  M¼ÀZÀgÀAr ZÉĂA§gÀUÀ¼À zÀÄgÀ¹Ü ªÀiÁqÀÄªÀzÀÄ.",Regarding UGd Line work At   Navangar & Shanth Nagar in ward no 24,30-May-15,20000,08-Jun-15,20000
603,1383,29-May-15,71086,Capital-Civil,Civil,Narendra Veeranna Siddappa,"ºÀÄ.«.ªÁqÀđ £ÀA 25 gÀ zsÀªÀÄđ¥ÀÆj §qÁªÀuÉ, GtPÀ¯ï ZÀZÀđ ºÀwÛgÀ ¥ÉmÉÆæĂ¯ï §APï ºÀwÛgÀ ºÁUÀÆ ¸Á¬Ä£ÀUÀgÀ PÉÆPÁn ±Á¯É ºÀwÛgÀ M¼ÀZÀgÀAr ZÉĂA§gÀUÀ¼À zÀÄgÀ¹Ü ªÀiÁr PÀªÀgÀ ºÁPÀÄªÀzÀÄ. ºÁUÀÆ  ¨sÉÊjzÉĂªÀgÀPÉÆ¥Àà gÉĂtÄPÁ£ÀUÀgÀzÀ°è ºÉÆ¸À ZÉĂA§gÀ PÀlÄÖªÀzÀÄ.","Regarding UGD Line work At Dharmpur Badavane, Unkal Chruch,  Petrol bunk Near Sai Nagar Kokate School in ward no 25",30-May-15,29043,08-Jun-15,29043
604,1298,27-May-15,70814,Capital-Civil,Civil,Panchaputra Madan M,ºÀÄ.«.ªÁqÀđ £ÀA 37 gÀ vÁjºÁ¼À UÁæªÀÄzÀ ªÀÄ¸ÀÆw  »A¢£À M¼ÀgÀ¸ÉÛUÀ¼À°è M¼ÀZÀgÀAr PÉÆ¼ÀªÉ ºÁPÀÄªÀzÀÄ.,Regarding UGD Work At Tarihal Gram Masuthi back side road. in ward no 37,01-Jun-15,290461,08-Jun-15,290461
605,1315,28-May-15,70050,Capital-Civil,Civil,Chinchalli Doddamudakappa Y,zsÁgÀªÁqÀ «¨ÁUÀzÀ ªÀ®AiÀÄ PÀZÉĂj £ÀA 12 ªÁqÀđ  £ÀA 22 gÀ PÉ.JZï.©.PÁ¯ÉÆ¤ ¯Á¸ÀÖ §¸ï ¸ÁÖ¥ï ºÀwÛgÀ vÉgÉzÀ ZÀgÀArUÉ Dgï.¹.¹ zÀ¨Á¸À ºÁPÀÄªÀzÀÄ ªÀÄvÀÄÛ ¹.r. zÀÄgÀ¹Ü ºÁUÀÆ Dgï.© ¥ÁnĂ® ªÀÄ£É ºÀwÛ vÉgÉzÀ ZÀgÀAr ªÀiÁqÀÄªÀzÀÄ.,Regarding Open drain work At K.H.B. Colony Near  Last Bus Stop. in ward no 22,30-May-15,93278,08-Jun-15,93278
606,1153,22-May-15,71394,Capital-Civil,Civil,Walikar Ashok Parasappa,ºÀÄ.«.ªÁqÀđ £ÀA 38 gÀ CA¨ÉĂqÀ̀gÀ PÁ¯ÉÆ¤AiÀÄ°è PÁA§¼É CªÀgÀ ªÀÄ£É ºÀwÛgÀ M¼ÀZÀgÀAr PÉÆ¼ÀªÉ ºÁQ ZÉĂA§gÀ zÀÄgÀ¹ÜUÉÆ½¸ÀÄªÀzÀÄ.,Regarding UGD Line work At Ambedkar Colony Near  Kambale Residence in ward no 38,30-May-15,46636,08-Jun-15,46636
607,1152,22-May-15,71393,Capital-Civil,Civil,Walikar Ashok Parasappa,"ºÀÄ.«.ªÁqÀđ £ÀªÀÄ 38 gÀ°è D£ÀAzÀ£ÀUÀgÀ, ªÉAPÀmÉĂ±ÀégÀ PÁ¯ÉÆ¤, ±ÀQÛ£ÀUÀgÀ, CgÀÄt PÁ¯ÉÆ¤AiÀÄ°è  ZÉA§gÀ zÀÄgÀ¹ÜUÉÆ½¸ÀÄªÀzÀÄ.","Regarding Drain work At Anand Nagar. & Venkateshwar Colony, Arun Colony, Shakthi Nagar. in ward no 38",30-May-15,80618,08-Jun-15,80618
608,1587,05-Jun-15,67676,Capital-Civil,Civil,Bhojagar Shankar R,ºÀÄ.«.ªÁqÀđ £ÀA49gÀ £ÀÆgÀeÁ£À ªÀÄ£É¬ÄAzÀ ªÀÄAlÆgÀ gÀ¸ÉÛAiÀÄªÀgÉUÉ Dgï ¹ ¹ vÉgÉzÀ ZÀgÀAr  PÀlÄÖªÀzÀÄ. EAqÉAl £ÀA:- 21803,Regarding RCC Drain works at Nurjan House mantur Road in ward no : 49,08-Jun-15,341886,08-Jun-15,341886
609,12201,31-Mar-10,26232,Capital-Civil,Civil,Hanji C Vinayak,zsÁgÀªÁqÀ «¨ÁUÀzÀ ªÀ®AiÀÄ PÀZÉĂj £ÀA 03 ªÁqÀđ  £ÀA 15 gÀ ²ªÁ£ÀAzÀ £ÀUÀgÀ 2 £ÉĂ CqÀØ gÀ¸ÉÛAiÀÄ°è Dgï.¹.¹ UÀmÁgÀ ¤«Äđ¸ÀÄªÀÅzÀÄ. ²ªÀ¥ÀÆgÀ PÁ®¤ gÀ¸ÉÛUÀ½UÉ qÁA§jĂPÀgÀt ªÀiÁqÀÄªÀÅzÀÄ. ºÁUÀÆ ºÉÆ£ÀßwÛ ZÁ¼À gÀ¸ÉÛUÉ qÁA§jĂPÀgÀt ªÀiÁqÀÄªÀÅzÀÄ.,Regarding Shivanand Nagar Roads Drains in ward No 15 of Zonal no 03,31-Mar-10,1006923,11-Jun-15,142119
610,1559,04-Jun-15,71670,Capital-Civil,Civil,Laxman .N.,ºÀÄ.«.ªÁqÀđ.£ÀA.39gÀ°è UÀÄrºÁ¼À gÉÆĂqÀ ¸ÁzÀvÀ PÁ®¤ ºÀwÛgÀ M¼ÀZÀgÀAr PÉÆ¼ÀªÉ ºÁPÀÄªÀÅzÀÄ ºÁUÀÆ ZÉĂA§gÀ PÀlÄÖªÀÅzÀÄ.,Regarding UGD Line Work at Gudihal in ward no.39,12-Jun-15,67431,18-Jun-15,67431
611,1558,04-Jun-15,71672,Capital-Civil,Civil,Laxman .N.,ºÀÄ.«.ªÁqÀđ.£ÀA.39gÀ°è UÀÄrºÁ¼À ªÀÄÄRågÀ¸ÉÛ CzsÁå¥ÀPÀ£ÀUÀgÀ 3£ÉĂ G¥ÀgÀ¸ÉÛAiÀÄ°è M¼ÀZÀgÀAr PÉÆ¼ÀªÉ ºÁQ ZÉĂA§gÀ PÀlÄÖªÀÅzÀÄ.,Regarding UGD Line Work at Gudihal in ward no.39,12-Jun-15,98035,18-Jun-15,98035
612,1557,04-Jun-15,71673,Capital-Civil,Civil,Laxman .N.,ºÀÄ.«.ªÁqÀđ.£ÀA.39gÀ°è AiÀÄÄ.PÉ.n »®́ UÀÄrºÁ¼À ªÀÄÄRågÀ¸ÉÛAiÀÄ°è M¼ÀZÀgÀAr PÉÆ¼ÀªÉ ºÁPÀÄªÀÅzÀÄ ºÁUÀÆ ZÉĂA§gÀ PÀlÄÖªÀÅzÀÄ.,Regarding UGD Line Work at U.K.T Hills in ward no.39,12-Jun-15,25228,18-Jun-15,25228
613,2048,19-Jun-15,68773,Capital-Civil,Civil,Patil Ravi .A.,"ºÀÄ.«.ªÁqÀđ £ÀA33gÀ°è ««zÀ PÀqÉAiÀÄ°è Dgï ¹ ¹ ¹. r. ¤«Äđ¸ÀÄªÀzÀÄ.(EA¢gÁ PÁ¯ÉÆĂ¤, zÉĂ±À¥ÁÀAqÉ ¯ÉĂOmï ±ÁSÁA§j §qÁªÀuÉ)EAqÉAl £ÀA:- 21772",Regarding RCC Drain works at Indira colony  in ward no : 33,20-Jun-15,613076,22-Jun-15,613076
614,2051,19-Jun-15,68774,Capital-Civil,Civil,Patil Ravi .A.,ºÀÄ.«..ªÁqÀđ £ÀA33gÀ GzÀAiÀÄ£ÀUÀgÀzÀ°è ²æĂ gÀªÉÄĂ±À eÉÆĂ¬Ä¸ï CªÀgÀ ªÀÄ£É¬ÄAzÀ £ÁåAiÀÄ ¨É¯ÉAiÀÄ CAUÀrAiÀÄªÀgÉUÉ Dgï ¹ ¹ vÉgÉzÀ ZÀgÀAr PÀlÄÖªÀzÀÄ. ºÁUÀÆ ¹.r. ¤«Äđ¸ÀÄªÀzÀÄ.EAqÉAl £ÀA:-21806,Regarding RCC Drain works at Uday nagar in ward no : 33,20-Jun-15,558882,22-Jun-15,558882
615,2081,20-Jun-15,70545,Capital-Civil,Civil,Rayangoudar Ravindragoudar Takangouda,ºÀÄ.«.ªÁqÀđ £ÀA 23 gÀ £ÀªÀ£ÀUÀgÀ EqÀ§ÆèJ¸ï-7£ÉĂ CqÀØ gÀ¸ÉÛUÉ Dgï.¹.¹.UÀmÁgÀ ºÁUÀÆ Dgï.¹.¹. vÉgÉzÀ ZÀgÀAr PÀlÄÖªÀzÀÄ.,Construction of RCC Drain at Navanagar EWS 7th cross.,24-Jun-15,1435725,24-Jun-15,1435725
616,1779,10-Jun-15,67898,Capital-Civil,Budgeted Works 2014-15,Hanchin V B,ºÀÄ§â½èAiÀÄ PÉÆĂlđ JzÀÄgÀUÉ EgÀÄªÀ ¥Á°PÉ MqÉvÀ£ÀzÀ ¹nJ¸ï £ÀA 173 gÀ°è ªÀiÁf ªÀÄÄRåªÀÄAwæUÀ¼ÀÄ ²æĂ J¸ï Dgï ¨ÉÆĂªÀiÁä¬Ä EªÀgÀ PÀAa£À ¥ÀÄvÀÜ½ C¼ÀªÀr¸ÀÄªÀÅzÀÄ E.£ÀA-22011.,Regarding Statue work At Hubli Division Court Opp,22-Jun-15,966445,07-Jul-15,966445
617,1440,01-Jun-15,68377,Capital-Civil,Civil,Nayak T.D.,ºÀÄ§â½î «¨sÁUÀzÀ  ªÁqÀđ £ÀA.35gÀ ²gÀÆgÀ ¥ÁPÀđ ªÉÆzÀ®£É ºÀAvÀ GzÁå£ÀzÀ°è ¥ÁvÀªÉ ¤«Äđ¸ÀÄªÀÅzÀÄ,Regarding Gardens works at Shirur Park in ward no : 35,06-Jun-15,390095,07-Jul-15,390095
618,1604,06-Jun-15,68818,Capital-Civil,Civil,Hanchinmani Nagesh R,ºÀÄ§â½î «¨sÁUÀzÀ  ªÁqÀđ £ÀA.46gÀ  zÉĂ±À¥ÁAqÉ£ÀUÀgÀ  2£ÉĂ ªÀÄÄRågÀ¸ÉÛ ¨ÉtV PÁA¥ÀèPÀ́ JzÀÄj£À gÀ¸ÉÛ JgÀqÀÄ §¢UÉ Dgï.¹.¹.  ¤ªÀiÁđt. EAqÉAl £ÀA:--21834,Regarding RCC Drain works at Deshapande  Nagar Benagi Complex in ward no : 46,11-Jun-15,495453,07-Jul-15,495453
619,2153,25-Jun-15,70494,Capital-Civil,Civil,Charantimath Sadanand S,ºÀÄ.«.ªÁ.£ÀA.31gÀ ±À§j £ÀUÀgÀzÀ°è ºÁUÀÆ ¢ªÁPÀgÀ D¸ÀàvÉæ ºÀwÛgÀ ZÉĂA§gÀ zÀÄgÀ¹Û ªÀiÁr PÀªÀgÀ ºÁPÀÄªÀÅzÀÄ.,Regarding Drain work at Shabari Nagar in ward no.31,26-Jun-15,29248,07-Jul-15,29248
620,2152,25-Jun-15,70495,Capital-Civil,Civil,Charantimath Sadanand S,ºÀÄ.«.ªÁ.£ÀA.31gÀ PÀÄ¸ÀÄUÀ® gÀ¸ÉÛ(¸ÀéuÁđUÁqÀđ£À) JzÀÄgÀUÀqÉ ºÁUÀÆ gÀUÀÄ£Á C¥ÁlđªÉÄAl gÀ¸ÉÛAiÀÄ°è ZÉĂA§gÀ zÀÄgÀ¹Û ªÀiÁr PÀªÀgÀ ºÁPÀÄªÀÅzÀÄ.,Regarding Drain work at Kusugal Road in ward no.31,26-Jun-15,26634,07-Jul-15,26634
621,2276,26-Jun-15,68467,Capital-Civil,Civil,Dayagodi Umesh,ºÀÄ.«.ªÁqÀđ.£ÀA.32gÀ°è ªÀÄÄQÛzsÁªÀÄ gÀ¸ÉÛÀ zÀAqÀ¥Àà£ÀªÀgÀ ªÀÄ£É ºÁUÀÆ zÀAiÀiÁ£ÀAzÀ PÁ¯ÉÆĂ¤ £ÁAiÀÄPÀ zÉÆqÀØ £Á¯ÁzÀªÀgÉUÉ Dgï¹ ¹ UÀmÁgÀ ¤«Äđ¸ÀÄªÀzÀÄ AiÀÄÄ.¹.Dgï UÀmÁgÀªÀ£ÀÄß vÉgÉªÀÅUÉÆ½¹)EAqÉAl £ÀA21778,Regarding RCC Drain works at Dayanand Coloni in ward no : 26,29-Jun-15,497677,07-Jul-15,497677
622,2101,22-Jun-15,71543,Capital-Civil,Civil,Ravikumar A Gutti,zsÁgÀªÁqÀ «¨ÁUÀzÀ ªÀ®AiÀÄ PÀZÉĂj £ÀA 03 ªÁqÀđ £ÀA 12 gÀ ªÀÄºÁ£ÀUÀgÀ ¥Á°PÉ ªÀÄÄR DªÀgÀtzÀ°è  M¼ÀZÀgÀAr  ZÉĂA§gÀ PÀlÄÖªÀzÀÄ ºÁUÀÆ PÉÆ¼ÀªÉ zÀÄgÀ¹Ü ªÀiÁqÀÄªÀzÀÄ.,Regarding UGD Line WOrk At Hubli  Dharwad Mahangar Palike ( Dharwad Division) in ward no 12,27-Jun-15,23995,07-Jul-15,23995
623,2283,26-Jun-15,69806,Capital-Civil,Civil,Palkar Shivayogi Channappa,zsÁgÀªÁqÀ «¨ÁUÀzÀ ªÀ®AiÀÄ PÀZÉĂj £ÀA 12  ªÁqÀđ £ÀA 22gÀ £ÀÄVÎPÉĂj ¥ÁAqÀÄgÀAUÀ £ÀUÀgÀzÀ°è J®èªÀÄä UÀÄr ºÀwÛgÀ vÉgÉzÀ ZÀgÀAr ¤«Äđ¸ÀÄªÀzÀÄ (EAqÉĂ£ïÖ £ÀA.25695),Regarding Construction Open Drinaje in Nuggikeri Panduranga Nagar Near Yallamma Temple in Ward No 22,29-Jun-15,283714,07-Jul-15,283714
624,2529,03-Jul-15,68801,Capital-Civil,Civil,Manjunathgouda Naganagouda Malagoudar,ºÀÄ§â½î «¨sÁUÀzÀ ªÁqÀđ £ÀA.26gÀ ªÁå¦ÛAiÀÄ°ègÀÄªÀ §½UÁgÀ NtÂAiÀÄ°è vÉgÉzÀ Dgï.¹.¹. ZÀgÀAr ºÁUÀÆ ¹.r ¤«Äđ¸ÀÄªÀÅzÀÄ.,Regarding RCC Drain works at Baligar oni in ward no : 26,04-Jul-15,564512,07-Jul-15,564512
625,2311,27-Jun-15,70288,Capital-Civil,Civil,Shibhargatti Z.T,zsÁgÀªÁqÀ «¨sÁUÀzÀ ªÀ®AiÀÄ PÀZÉĂj £ÀA 12 ªÁqÀđ £ÀA 22 gÀ ¸ÀvÀÆÛgÀ D±ÀæAiÀÄPÁ¯ÉÆ¤AiÀÄ°è vÉgÉzÀ ZÀgÀAr ¤«Äđ¸ÀÄªÀzÀÄ.(EAqÉĂ£ïÖ £ÀA.25693),Regarding Open Drai work At Sattur Ashraya Colony in ward no 22,06-Jul-15,2414958,07-Jul-15,2414958
626,2499,02-Jul-15,69640,Capital-Civil,Budgeted Works 2014-15,Krishna N.,ºÀÄ.«.ªÁqÀđ £ÀA 40 gÀ ªÀiÁgÀÄw£ÀUÀgÀ ºÉUÉÎj ¸À±Á£ÀzÀ°è C©üªÀÈ¢üƯ PÁªÀÄUÁj PÉÊUÉÆ¼ÀÄªÀzÀÄ.,"Regarding Samshan work At Maruthi Nagar, Heggeri in ward no 40",07-Jul-15,1389968,08-Jul-15,1389968
627,2677,08-Jul-15,68270,Capital-Civil,Civil,Jadhav V.S.,"zsÁgÀªÁqÀ «¨ÁUÀzÀ ªÀ®AiÀÄ PÀZÉĂj £ÀA 12 ªÁqÀđ £ÀA  19 gÀ ªÀÄ¢£Á ºË¹AUï PÁ®¤ «zÁåVjAiÀÄ°è,«ªÉĂPÁ£ÀAzÀ£ÀUÀgÀ qÁA§jĂPÀgÀt ºÁUÀÆ £ÁAiÀÄ̀gÀ ºÁ¸ÉÖĂ¯ï ºÀwÛgÀ PÁAQæĂl gÀ¸ÉÛ ¤«Äđ¸ÀÄªÀÅzÀÄ ªÀÄvÀÄÛ ¸ÀgÀ¸ÀévÀ¥ÀÄgÀzÀ°è vÉgÉzÀ ZÀgÀAr PÀlÄÖªÀÅzÀÄ. (EAqÉĂ£ïÖ £ÀA.21680)","Regarding Concret Drain works at Madina Houseing Colony, Vidyagiri, Vivekanand Nagar Black top road works in ward No : 19",13-Jul-15,1762967,14-Jul-15,1762967
628,3042,21-Jul-15,72353,Capital-Civil,Budgeted Works 2015-16,Raju S.R.,"ºÀÄ.«.ªÁqÀđ £ÀA 38 ºÁUÀÆ 40 gÀ°èAiÀÄ ±ÀQÛ£ÀUÀgÀ¢AzÀ  £ÁUÀ°AUÀ£ÀUÀgÀ, ¨ÁåAPÀgÀ́ PÁ¯ÉÆ¤. dUÀ¢Ă±À£ÀUÀgÀ ªÀiÁUÀđªÁV ºÉUÉÎĂj ¸Àä±Á£ÀªÉgÉUÉ £Á¯ÁzÀ°èAiÀÄ ºÀÆ¼ÀÄ vÉUÉAiÀÄÄªÀzÀÄ.","Regarding Nala work At  To Nagling Nagar, Bankars Colony, Jagadish Nagar & Heggeri. in ward no 38.40",25-Jul-15,1064066,25-Jul-15,1064066
629,2668,08-Jul-15,52052,Capital-Civil,Budgeted Works 2011-12,Suresh Enterprises Pvt Ltd,ºÀÄ.« ªÁqÀđ £ÀA. 38 gÀ°è D£ÀAzÀ £ÀUÀgÀ CA¨ÉĂqÀ̀gÀ £ÀUÀgÀ ªÀÄzsÀå £Á¯ÁUÉ ¸ÉĂvÀÄªÉ ¤ªÀiÁđt ªÀiÁqÀÄªÀÅzÀÄ.,In Ward No. 38 In between Anand Nagar and Ambedkar Nagar Providing T-Beam Bridge.,29-Jul-15,863490,29-Jul-15,863490
630,3109,24-Jul-15,71066,Capital-Civil,Budgeted Works 2014-15,Channalli V.B.,ºÀÄ.«.ªÁqÀđ £ÀA 29 gÀ ªÀÄÄ¹èA ¸ÀªÀiÁdzÀ ¸Àä±Á£ÀªÀ£ÀÄß C©üªÀÈ¢̃ ¥Àr¸ÀÄªÀzÀÄ.,Regarding Burral Groaund Development work At Hubli Division in ward no 29,29-Jul-15,1881528,29-Jul-15,1881528
631,3189,27-Jul-15,71378,Capital-Civil,Budgeted Works 2014-15,Raju S.R.,"EAqÉAmï £ÀA.27689, ºÀÄ.«.ªÁqÀđ.£ÀA.59gÀ PÀÄ¨Áđ£À±ÁªÀ° R§gÀ¸ÁÜ£À(¸Àä±Á£À) C©üªÀÈ¢̃¥Àr¸ÀÄªÀÅzÀÄ.",Regarding Burial Ground Development work at Kurbanshavali in ward no.59,30-Jul-15,694101,30-Jul-15,694101
