S. No,Br. No ,Br. Date ,Recid,Main_Category,Passed_Category,Contractor_name,Description_Kan,Description_Eng,Bill Pass Date,Bill Pass Amt,Paid Date,Paid Amt
1,10630,28-Mar-15,64429,13th Finance,13th Finance-2013-14(Electrical),Ujjwala Enterprises Hubli,"ºÀÄ§â½îAiÀÄ ªÁqÀđ £ÀA 35 gÀ°è §gÀÄªÀ ZÉĂvÀ£Á PÁ¯ÉĂd, CPÀëAiÀÄ PÁ®¤ ªÀÄÄRå gÀ¸ÉÛAiÀÄ°èAiÀÄ ""ÄrAiÀÄ£À ©Ă¢ ¢Ă¥ÀUÀ¼À PÉĂ§® ºÁUÀÆ ¥É£À® ¨ÉÆĂqÀđ, PÀAmÉÆæĂ® ¨ÁPÀ́ EvÁå¢UÀ¼À£ÀÄß §zÀ¯ÁÄ¸ÀÄªÀzÀÄ","Providing median Straight lights cable and penal board, control box etc in Chetan college Aksya colony 
main roads in ward No.35",01-Apr-15,214413,08-Apr-15,214413
2,9973,11-Mar-15,55970,13th Finance,13th Finance-2012-13(Electrical),Deepa Solar Lighting Systems,2012-13 £ÉĂ ¸Á°£À 13 £ÉĂ ºÀtPÁ¸ÀÄ C£ÀÄzÁ£ÀzÀ CrAiÀÄ°èAiÀÄ ©Ă¢ ¢Ă¥À C¼ÀªÀrPÉ PÁªÀÄUÁjUÀ¼ÀÄ.,Electrical Works under 13th Finance for the year 2012-13,09-Apr-15,426740,10-Apr-15,426740
3,10740,30-Mar-15,65824,13th Finance,13th Finance-2013-14(RD_BRDG),Bharat Enterprises Hubli (Bagi),ºÀÄ.«.ªÁqÀđ £ÀA 46 gÀ £ÀÆåPÁl£ï ªÀiÁPÉđl ¢AzÀ «L¦ gÀ¸ÉÛ ºÁUÀÆ ¦PÉÆĂPï ºÉÆĂmÉ¯ï gÀ¸ÉÛ¬ÄAzÀ ¥ÉÆĂ°¸ï ¸ÉÖĂµÀ£ï ªÀgÉV£À gÀ¸ÉÛUÀ¼À£ÀÄß ¸ÀÄzsÁgÀuÉ ªÀiÁqÀÄªÀÅzÀÄ,Improvement road of New Cotton market of VIP road from Peacock hotel to Police Station and reapir to culvert of ward No : 46,09-Apr-15,1494030,10-Apr-15,1494030
4,10902,31-Mar-15,62185,13th Finance,13th Finance(P)2012-13(UGD),Gudadur R.R.,zsÁgÀªÁqÀ «¨ÁUÀzÀ ªÀ®AiÀÄ PÀZÉĂj £ÀA 03 ªÁqÀđ £ÀA 12 gÀ ¸ÉÊzÁ¥ÀÆgÀ zÀAr£À NtÂ ¨sÁUÀzÀ°è M¼ÀZÀgÀAr ZÉĂA§gÀ ¸ÀÄzsÁgÀuÉ ªÀiÁqÀÄªÀÅzÀÄ. (EAqÉĂ£ïÖ £ÀA. 17238),Regareding UGD Line Work At Saidapur Dhandin Oni. in ward no 12 of Dharwad,09-Apr-15,517084,20-Apr-15,517084
5,10840,31-Mar-15,66340,13th Finance,13th Finance(P)2012-13(swm),Ray Engineers and Fabricators Belgaum,¥Áè¹ÖPï ¨ÉÊ°AUï  0.8 ¸ÁªÀÄxÀåđ AiÀÄAvÀæªÀ£ÀÄß ¥ÀÆgÉÊ¸ÀÄªÀ PÀÄjvÀÄ.,Supply of Plastic Balling Machine Capacity 0.8 ton/day,20-Apr-15,638800,20-Apr-15,638800
6,10944,31-Mar-15,62117,13th Finance,13th Finance-2013-14(UGD),M M Patil,zsÁgÀªÁqÀ «¨ÁUÀzÀ ªÀ®AiÀÄ PÀZÉĂj £ÀA 01 ªÁqÀđ £ÀA 02gÀ°è ºÀÄqÉÆ̀Ă PÁ®¤AiÀÄ°è M¼ÀZÀgÀAr ¯ÉÊ£À ºÁPÀÄªÀÅzÀÄ  ºÁUÀÆ ZÉĂA§gÀ PÀlÄÖªÀÅzÀÄ. (EAqÉĂ£ïÖ £ÀA. 16821),Laying of UGD line and construction of chambers in HUDCO colony ward No.2 of Dharwad,13-Apr-15,381493,20-Apr-15,381493
7,140,15-Apr-15,61711,13th Finance,13th Finance(P)2012-13(UGD),Doddamani S.M.,¥ÀAZÁPÀëj £ÀUÀgÀ CqÀØgÀ¸ÉÛUÀ¼À°è M¼ÀZÀgÀAr PÉÆ¼ÀªÉ ªÀiÁUÀđ ¸ÀÄzsÁgÀuÉ.,Providing and laying UGD at Panchakshri Nagar cross road in w.no.23,24-Apr-15,451638,24-Apr-15,451638
8,350,22-Apr-15,70640,13th Finance,13th Finance-2012-13(UGD),Raju S.R.,"EAqÉAmï £ÀA.27102, ºÀÄ.«ªÁqÀđ £ÀA.64gÀ SÁ¢æĂAiÀiÁ mË£ÀzÀ°è ºÁUÀÆ E¸ÁèA¥ÀÆgÀzÀ°è M¼ÀZÀgÀAr PÉÆ¼ÀªÉ ªÀiÁUÀđ C¼ÀªÀr¸ÀÄªÀzÀÄ",Providing UGD line to Khadriya town & Islampur at ward no. 64,24-Apr-15,440044,24-Apr-15,440044
9,218,16-Apr-15,63698,13th Finance,13th Finance(P)2012-13(Bldg),M C Paintermulla,zsÁgÀªÁqÀ «¨ÁUÀzÀ ªÀ®AiÀÄ PÀZÉĂj £ÀA02 ªÁqÀđ £ÀA 11gÀ ºÉÆ¸À PÀlÖqÀPÉ̀ G½zÀ zÀÄgÀ¹Ü PÁªÀÄUÁj. (EAqÉĂ£ïÖ £ÀA. 16811),Regarding Building Work At Dharwad Division ( Zonal 2 ),27-Apr-15,293254,02-May-15,293254
10,271,18-Apr-15,67450,13th Finance,13th Finance(P)2012-13(Bldg),Hanchinmani Nagesh R,ºÀÄ§â½î «.ªÁqÀđ 28 gÀ PÀ£ÀßqÀ ¨sÀªÀ£À ¨ÁQ PÁªÀÄUÁjUÀ¼À£ÀÄß ¥ÀÆtđUÉÆ½¸ÀÄªÀÅzÀÄ E.£ÀA-18442.,Regarding Building Work At Kannada Bhavan Hubli Division,07-May-15,1054953,08-May-15,1054953
11,799,08-May-15,70812,13th Finance,13th Finance(P)2013-14(UGD),Krishna N.,ºÀÄ.«ªÁqÀđ £ÀA.40gÀ ªÀÄzÀ¤ PÁ®¤ ºÁUÀÆ UÀÄr ¥ÁèlzÀ°è M¼ÀZÀgÀAr PÉÆ¼ÀªÉ C¼ÀªÀr¸ÀÄªÀÅzÀÄ.,Providing UGD line toMadani colony and Gudi plot at ward no. 40.,18-May-15,557962,18-May-15,557962
12,800,08-May-15,70811,13th Finance,13th Finance(P)2013-14(UGD),Krishna N.,"ºÀÄ.«ªÁqÀđ £ÀA.39gÀ PÀÈµÀÚVj PÁ®¤, ¨ÁåºÀnÖ ¥Áèl ºÁUÀÆ WÉÆĂqÀPÉ ¥ÁèlzÀ°è M¼ÀZÀgÀAr PÉÆ¼ÀªÉ C¼ÀªÀr¸ÀÄªÀÅzÀÄ.","Providing UGD line to Krishanagiri colony, Bhyatti plot and Godake Plot  at ward no. 39",18-May-15,551106,18-May-15,551106
13,826,11-May-15,61482,13th Finance,13th Finance(P)2012-13(UGD),Ambiger Pamppanna Irappa,"EAqÉAmï £ÀA.15653, ºÀÄ.«.ªÁqï £ÀA 41 gÀ «PÁ¸À £ÀUÀgÀ M¼ÀZÀgÀ¸ÉÛUÀ¼À°è ºÉÆ¸ÀzÁV M¼ÀZÀgÀAr PÉÆ¼ÀªÉ ºÁPÀÄªÀÅzÀÄ.",Regarding UGD Line Work At Vikas nagar. in ward no 41,21-May-15,195239,21-May-15,195239
14,961,15-May-15,62116,13th Finance,13th Finance(P)2012-13(Drain),M M Patil,zsÁgÀªÁqÀ «¨ÁUÀzÀ ªÀ®AiÀÄ PÀZÉĂj £ÀA 12 ªÁqÀđ £ÀA 21gÀ £ÀªÀ®ÆgÀ «£ÁAiÀÄPÀ£ÀUÀgÀzÀ°è vÉgÉzÀ ZÀgÀAr ¤«Äđ¸ÀÄªÀÅzÀÄ. (EAqÉĂ£ïÖ £ÀA.16870),Construction of Open drain at Vinayak nagar navlor in ward no .21. of Dharwad,23-May-15,522455,25-May-15,522455
15,1029,18-May-15,70816,13th Finance,13th Finance(P)2013-14(Drain),Savadi S.K.,zsÁgÀªÁqÀ «¨sÁUÀzÀ  ªÀ®AiÀÄ PÀZÉĂj £ÀA 01 ªÁqÀđ £ÀA 17  gÀ ¹ © £ÀUÀgÀ ®AUÉÆĂn PÉgÉ ¥ÀPÀzÀ°è ºÁUÀÆ ²æĂ ªÀÄwÛPÀnÖ ªÀÄ£É ªÀÄÄA¢£À gÀ¸ÉÛ  vÉgÉzÀ ZÀgÀAr ¤«Äđ¸ÀÄªÀÅzÀÄ. (EAqÉĂ£ïÖ £ÀA. 27138),Construction of open  drain infront of Mattigatti house road and by the side of Langotikeri  at C.B. Nagar in ward No.17 of Dharwad,23-May-15,2139513,25-May-15,2139513
16,1133,21-May-15,70350,13th Finance,13th Finance-2013-14(Drain),Savadi S.K.,zsÁ.«.ªÁqÀđ £ÀA 05 ±ÁAwPÁ®¤AiÀÄ°è DAiÀÄƯ ¨sÁUÀzÀ°è £Á¯Á ¸ÀÄzsÁgÀuÉ ªÀiÁqÀÄªÀÅzÀÄ.(EAqÉĂ£ïÖ £ÀA.17237),Improvements of Nalas in Shanti colony selected division in ward no 5 at dharwad.,25-May-15,702092,25-May-15,702092
17,1277,27-May-15,70417,13th Finance,13th Finance(P)2012-13(Drain),Talikoti Ravi G,"EAqÉAmï £ÀA.27062, ºÀÄ.«.ªÁqÀđ £ÀA 58 gÀ°è §qÀUÉĂgÀ NtÂ¬ÄAzÀ ¸ÀÄzsÁºÉÆmÉ®ªÀgÉUÉ Dgï.¹.¹ vÉgÉzÀ ZÀgÀAr ªÉÄĂ¯É ¸Áå¨ï ºÁPÀÄªÀzÀÄ ºÁUÀÆ ªÁqÀđ £ÀA 66 gÀ ©qÁß¼À PÁæ¸ï zÀ°è vÉgÉzÀ ZÀgÀAr ºÁUÀÆ ¹.r ¤«Äđ¸ÀÄªÀzÀÄ.",Regarding RCC Drain work At Badiger Oni To Sudha Hotel. & ward no 66 Bidnal Cross. in ward no 58,01-Jun-15,797290,01-Jun-15,797290
18,1202,25-May-15,71098,13th Finance,13th Finance-2014-15(Drain),Talikoti Ravi G,"EAqÉAmï £ÀA.26993, ºÀÄ.«.ªÁqÀđ £ÀA.55gÀ ²A¦UÀ°è PÁæ¸À¢AzÀ UÀ§ÆâgÀUÀ°è PÁæ¸ïªÀgÉUÉ, ªÁqÀđ £ÀA.57gÀ ±ÁAw¤PÉĂvÀ£ 1£ÉĂ ªÀÄÄRå gÀ¸ÉÛAiÀÄ°è Dgï.¹.¹ UÀmÁgÀ ¤«Äđ¸ÀÄªÀzÀÄ ºÁUÀÆ ªÁqÀđ £ÀA.58gÀ UÀ§ÆâgÀUÀ°è¬ÄAzÀ ²æĂ±ÉÊ® ªÀÄoÀzÀªÀgÉUÉ Dgï.¹.¹ UÀmÁgÀ ¤«Äđ¹ ¸Áèöå¨ï ºÁPÀÄªÀzÀÄ.","Construction of RCC Open drain in Shimpi galli cross to Gabbur galli cross at ward no. 55, Shantinikatan colony at ward no. 57 & Construction of Drain & Providing slab in Gabbur galli to Shrisail matha  at ward no. 58",01-Jun-15,608057,01-Jun-15,608057
19,1138,21-May-15,70935,13th Finance,13th Finance-2014-15(Drain),Bilebal Sanjay Gurappa,"EAqÉAmï £ÀA.27623, ºÀÄ.«.ªÁqÀđ £ÀA.42gÀ D¸ÁgÀ NtÂ UÀmÁgÀ ¤ªÀiÁđt ºÁUÀÆ ¢rØ NtÂAiÀÄ°è Cgï.¹.¹.UÀmÁgÀ ¤«Äđ¹ ¸Áèöå¨ï ºÁPÀÄªÀzÀÄ.",Construction of RCC Open drain in Asar oni & Construction of Drain & Providing slab in Diddi oni at ward no. 42,23-May-15,796627,03-Jun-15,796627
20,1590,05-Jun-15,67489,13th Finance,13th Finance(P)2012-13(Bldg),Vadavi Basavaraj B,ºÀÄ§â½î «¨sÁUÀzÀ ¥Á°PÉAiÀÄ MqÉvÀ£ÀzÀ ªÀ®AiÀÄ PÀbÉĂj £ÀA-04gÀ PÀlÖqÀ zÀÄgÀ¹Û ºÁUÀÆ £À«ĂPÀgÀt ªÀiÁqÀÄªÀzÀÄ,. Repairs and renuvation of zone office no-4 Part 2,10-Jun-15,873144,10-Jun-15,873144
21,2040,19-Jun-15,71369,13th Finance,13th Finance(P)2012-13(Bldg),Raju S.R.,"EAqÉAmï £ÀA.26910, ºÀÄ.«.ªÁqÀđ £ÀA 59gÀ°è §gÀÄªÀ ªÀ®AiÀÄ PÀZÉĂj £ÀA 11 gÀ PÀlÖqÀ £À«ĂPÀj¸ÀÄªÀzÀÄ.",Regarding  Building work At HDMC Zonel no 11. in ward no 59,22-Jun-15,936108,22-Jun-15,936108
22,2045,19-Jun-15,71371,13th Finance,13th Finance(P)2012-13(Garden),Raju S.R.,"EAqÉAmï £ÀA.27586, ºÀÄ « ªÁ £ÀA. 59gÀ UË¹AiÀiÁ mË£À UÁqÀđ£ï C©üªÀÈ¢̃¥Àr¸ÀÄªÀzÀÄ.",Improvements to Gousia Town Garden at ward no. 59,22-Jun-15,702011,22-Jun-15,702011
23,2123,23-Jun-15,71076,13th Finance,13th Finance-2014-15(UGD),Akki Prakash Gurubasappa,"EAqÉAmï £ÀA.27627, ºÀÄ.«.ªÁqÀđ £ÀA.63gÀ £ÀÆgÁ¤ ¥ÁèlzÀ°è G½zÀ ¨sÁUÀ, ²æĂgÁªÀÄ PÁ®¤, ¸ÀAvÉÆĂµÀ£ÀUÀgÀ ºÁUÀÆ CfäĂgÀ £ÀUÀgÀzÀ°è M¼ÀZÀgÀAr PÉÆ¼ÀªÉ ºÁPÀÄªÀzÀÄ.","Providing UGD line to Noorani plot remaining part, Shriram colony, Santosh nagar & Ajmir nagar at ward no. 63",24-Jun-15,1711814,24-Jun-15,1711814
24,2136,24-Jun-15,71077,13th Finance,13th Finance(P)2012-13(Drain),Kharadi J J,"EAqÉAmï £ÀA.27075, ºÀÄ.«.ªÁqÀđ £ÀA.44gÀ PÀªÀÄj¥ÉĂl JzÀÄjUÉ RgÁ¢ NtÂAiÀÄ°è Cgï.¹.¹.vÉgÉzÀ ZÀgÀAr ¤«Äđ¸ÀÄªÀzÀÄ.",Construction of RCC Drain opposite to Kamaripeth Kharadi Oni at ward no. 44.,29-Jun-15,727848,29-Jun-15,727848
25,2130,23-Jun-15,71390,13th Finance,13th Finance(P)2013-14(Drain),Doddamani R.M.,"EAqÉAmï £ÀA.27026, ºÀÄ«ªÁqÀđ £ÀA.67gÀ PÀÈ¶ PÁ«ÄđPÀgÀ £ÀUÀgÀzÀ°è ªÀÄ¼É ¤ĂgÀÄ ZÀgÀAr ¤«Äđ¸ÀÄªÀzÀÄ.",Construction of Drain in Krushi Karmika nagar at ward no. 67.,29-Jun-15,794168,29-Jun-15,794168
26,2165,25-Jun-15,71475,13th Finance,13th Finance(P)2013-14(Drain),Saleem N Lacchanna,zsÁgÀªÁqÀ ªÀ®AiÀÄ PÀZÉĂj £ÀA 02 ªÁqÀđ £ÀA 11 «¨sÁUÀzÀ ªÁqÀđ £ÀA. 11 gÀ°è gÀ¸ÀÆ®¥ÀÆgÀ NtÂAiÀÄ°è ºÁUÀÆ ²æĂ¤ªÁ¸À xÉĂlgÀ d£ÀvÁ ºÉÆĂmÉĂ¯ï §½ vÉgÉzÀ ZÀgÀAr ¤ªÀiÁđt PÁªÀÄUÁj. (EAqÉĂ£ïÖ £ÀA. 27151),Construction of open drain infront of Rasulapur oni and near Janatha Hotel at Srinivas Thetar in ward No. 11 of Dharwad,29-Jun-15,342311,29-Jun-15,342311
27,2131,23-Jun-15,71661,13th Finance,13th Finance-2011-12(Garden),Doddamani R.M.,"EAqÉAmï £ÀA.26913, ºÀÄ.«.ªÁqÀđ. £ÀA. 67gÀ ¸ÉÆĂ¤AiÀiÁUÁA¢ü £ÀUÀgÀzÀ°è UÁqÀđ£À C©üªÀÈ¢̃ ªÀiÁqÀÄªÀzÀÄ.",Improvements to Sonia Gandhi nagar Garden at ward no. 67,29-Jun-15,136343,29-Jun-15,136343
28,2099,22-Jun-15,71388,13th Finance,13th Finance-2013-14(Drain),Pattankari Basha Hajaratsab,"EAqÉAmï £ÀA.27028, ºÀÄ.«ªÁqÀđ £ÀA.52 vÀ©Ă§¯ÁåAqÀzÀ°è vÉgÉzÀ ZÀgÀAr PÀlÄÖªÀÅzÀÄ.",Constuction of Drain in Tabibland at ward no 52.,29-Jun-15,419529,29-Jun-15,419529
29,2142,24-Jun-15,71700,13th Finance,13th Finance-2014-15(RD_BRDG),Jadhav V.S.,zsÁgÀªÁqÀ «¨ÁUÀzÀ ªÀ®AiÀÄ PÀZÉĂj £ÀA 01 ªÁqÀđ £ÀA 14gÀ ªÀÄwÛPÀnÖAiÀÄªÀgÀ ªÀÄ£É ªÀÄÄA¢£À gÀ¸ÉÛ ºÁUÀÆ ¹.© £ÀUÀgÀ ®AUÉÆĂn PÉgÉ ¥ÀPÀ̀zÀ gÀ¸ÉÛ C©üªÀÈ¢̃ ¥Àr¸ÀÄªÀÅzÀÄ. (EAqÉĂ£ïÖ £ÀA. 27393),Regarding Roads Work at Mattikatti House in ward no.14,29-Jun-15,4651423,29-Jun-15,4651423
30,2437,30-Jun-15,70795,13th Finance,13th Finance-2011-12(Drain),Nagaraj Krishanappa,"EAqÉAmï £ÀA.27596, ºÀÄ.«.ªÁqÀđ. £ÀA. 58gÀ ±Á¯É £ÀA. 12gÀ »A¨sÁUÀzÀ°è vÉgÉzÀ ZÀgÀAr zÀÄgÀ¹Ü ºÁUÀÆ Dgï.¹.¹ ¸Áèöå¨ï ºÁPÀÄªÀzÀÄ.",Repairs of Drain & Providing slab behind School No. 12 at ward no. 58,04-Jul-15,118716,06-Jul-15,118716
31,2337,29-Jun-15,72770,13th Finance,13th Finance-2014-15(RD_BRDG),Jadhav V.S.,zsÁgÀªÁqÀ «¨ÁUÀzÀ ªÀ®AiÀÄ PÀZÉĂj £ÀA 02 ªÁqÀđ .06gÀ G¸ÀÄQ£À CqÉØ PÀApNtÂ GzÀÄđ ±Á¯É¬ÄAzÀ ¸ÀªÀzÀwÛ gÀ¸ÉÛAiÀÄªÀgÉUÉ gÀ¸ÉÛ C©üªÀÈ¢̃ PÁªÀÄUÁj. (EAqÉĂ£ïÖ £ÀA. 27390),Improvements to Road in Usukin adde kanti oni ward no. in.06 of Dharwad,06-Jul-15,2082709,06-Jul-15,2082709
32,2429,30-Jun-15,70528,13th Finance,13th Finance(P)2013-14(UGD),Vibhuti A.B.,"EAqÉAmï £ÀA.27000, ºÀÄ«ªÁqÀđ £ÀA.66gÀ ºÉÆ¸À UÀ§ÆâgÀ §¸ÀªÀ£ÀUÀgÀ, ±ÀgÀt£ÀUÀgÀ ºÁUÀÆ £ÉĂPÁgÀ£ÀUÀgÀ ¸ÀAAiÀÄÄPÀÛ PÀ£ÁđlPÀ PÁ®¤AiÀÄ°è ªÀÄvÀÄÛ ºÉÆ¸À UÀ§ÆâgÀ ²æĂ. G¥ÁàgÀ gÀªÀgÀ ªÀÄ£É¬ÄAzÀ ¦.©.gÉÆĂqÀ ªÀgÉUÉ M¼ÀZÀgÀAr PÉÆ¼ÀªÉ ºÁPÀÄªÀzÀÄ","Providing UGD line to New Gabbur Basavnagar, Sharan nagar & Nekarnagar Samyukt karnataka colony & New Gabbur Shri. Uppar home to PB road at ward no. 66",09-Jul-15,472671,09-Jul-15,472671
33,2369,29-Jun-15,71379,13th Finance,13th Finance-2011-12(Electrical),Devagiri Electricals,ºÀÄ§â½î «¨sÁUÀzÀ ªÁqÀđ £ÀA. 38 gÀ°è §gÀÄªÀ gÁªÀÄ ªÀÄ£ÉÆĂºÀgÀ¯ÉÆĂ»AiÀiÁ £ÀUÀgÀ ªÀÄÄRå gÀ¸ÉÛ PÉgÉ ¸ÉĂvÀÄªÉÄAzÀ PÀÄµÀ×gÉÆĂUÀ D¸ÀàvÉæUÉ ºÉÆĂUÀÄªÀ ªÀÄÄRå gÀ¸ÉÛAiÀÄ°è PÀA§UÀ¼À£ÀÄß ºÁUÀÆ ¯ÉÊ£ï C¼ÀªÀr¹ ©Ă¢¢Ă¥ÀUÀ¼À£ÀÄß C¼ÀªÀr¸ÀÄªÀÅzÀÄ.,"Erection of pole, street light line, supplying and fixing of street lights at the main road from Rammanohar Lohiyanagar to leprosy hospital of ward no. 38 Hubli division.",09-Jul-15,252108,09-Jul-15,252108
34,2637,07-Jul-15,66905,13th Finance,13th Finance-2012-13(SWM),TPS Infrastructure Limited,4000 °Ă ¸ÁªÀÄxÀåđzÀ eÉnÖAUï PÀªÀiï ¸ÉPÀë£ï ªÀÄ²Ă£À ¥ÀÆgÉÊ¸ÀÄªÀ PÀÄjvÀÄ. (2 £ÀA.),Chassis Mounted Combination Suction Cum Jetting Machine of Capacity 4000 ltr Mounted on a 9.0 ton GVW (02 Nos),09-Jul-15,5251012,09-Jul-15,5251012
35,2366,29-Jun-15,71392,13th Finance,13th Finance-2014-15(Electrical),Devagiri Electricals,ºÀÄ§â½î «¨sÁUÀzÀ ªÁqÀđ £ÀA 65 gÀ°è §gÀÄªÀ ««zsÀ ¸ÀÜ¼ÀUÀ¼À°è 4 «Ä¤ ºÉÊªÀiÁ¸ÀÖ ºÁUÀÆ ©Ă¢¢Ă¥ÀUÀ¼À£ÀÄß C¼ÀªÀr¸ÀÄªÀzÀÄ.,"Erection of 4 mini highmast, supplying and fixing of street lights at ward no. 65 of Hubli division.",09-Jul-15,376445,09-Jul-15,376445
36,2581,06-Jul-15,63765,13th Finance,13th Finance(P)2012-13(Drain),Tarlagatti C.Y.,ºÀÄ.«.ªÁqÀđ £ÀA 35 gÀ vÉÆĂ¼À£ÀPÉĂj vÀÄA© ºÀjzÀ£ÀAvÀgÀ ºÉÆgÀ ¤ĂgÀÄ ºÉÆĂUÀ®Ä PÁ½zÁ¸À £ÀUÀgÀ PÁæ¸À ªÀgÉUÉ Dgï.¹.¹ vÉgÉzÀ ZÀgÀAr ¤«Äđ¸ÀÄªÀÅzÀÄ.,Regarding Drain Work At Tholankeri To Kalidas nagar Cross in ward no 35,13-Jul-15,1659013,13-Jul-15,1659013
37,2578,04-Jul-15,63768,13th Finance,13th Finance-2013-14(Drain),Tarlagatti C.Y.,ºÀÄ§â½î ªÁqÀđ £ÀA. 35 vÉÆĂ¼À£À PÉgÉvÀÄA© ºÉZÁÑUÁzÀ ¥ÀæªÁºÀÀ ¤ĂgÀÄ  ²gÀÆgÀ ¥ÁPÀđ ºÀwÛgÀ GtPÀ¯ï £Á¯Á ªÀgÉUÉ  §¢AiÀÄ «£Áå¸ÀUÀ½UÉ vÉÆAzÀgÉ DUÀzÀAvÉ Dgï.¹.¹ ZÀgÀAr ¤«Äđ¸ÀÄªÀzÀÄ,Providing and contruction of RCC open drain to unakle nala to drain off exess flow from tolenkeri in w.no.35,13-Jul-15,3822202,13-Jul-15,3822202
38,2709,09-Jul-15,61558,13th Finance,13th Finance(P)2012-13(UGD),Ambiger Pamppanna Irappa,"EAqÉAmï £ÀA.15654, ºÀÄ.«.ªÁqÀđ £ÀA 41 gÀ ¹zÀ̃°AUÉĂ±ÀégÀ PÁ¯ÉÆĂ¤AiÀÄ°è M¼ÀZÀgÀªÀÄr PÉÆ¼ÀªÉ ºÁQ ZÉĂA§gÀUÀ¼À£ÀÄß PÀnÖ¸ÀÄªÀÅzÀÄ.",Regarding UGD Line Work At Siddlingeshwar Colony. in ward no 41.,13-Jul-15,854611,14-Jul-15,854611
39,2583,06-Jul-15,71215,13th Finance,13th Finance-2014-15(UGD),Panchputra Manjunath,ºÀÄ§â½î «¨sÁUÀzÀ ªÁqÀđ £ÀA. 27gÀ ¹zÀƯ¥ÀàdÓ£À UÀÄr »A¨sÁUÀzÀ ¹zÉƯ±ÀégÀ£ÀUÀgÀzÀ°è M¼ÀZÀgÀAr PÉÆ¼ÀªÉ ºÁPÀÄªÀÅzÀÄ.,Providing  U.G.D. line  ¨behind Siddappajjan gudi Siddeshwarngar at  ward no 27,13-Jul-15,461932,14-Jul-15,461932
40,2719,09-Jul-15,71554,13th Finance,13th Finance-2014-15(UGD),Bhojagar Shankar R,ºÀÄ.«.ªÁqÀđ.£ÀA.48gÀ ZÉĂvÀ£Á PÁ¯ÉÆĂ¤ ªÀÄÄRå gÀ¸ÉÛAiÀÄ°è M¼ÀZÀgÀAr PÉÆ¼ÀªÉ ºÁQ ZÉĂA§gï PÀlÄÖªÀzÀÄ.,Providing  U.G.D. line at Chetana colony main road in  ward no 48.,14-Jul-15,391838,14-Jul-15,391838
41,2799,13-Jul-15,72013,13th Finance,13th Finance-2014-15(UGD),Savadi S.K.,zsÁgÀªÁqÀ «¨sÁUÀzÀ ªÁqÀđ £ÀA. 8 gÀ°è JA.Dgï £ÀUÀgÀ 2£ÉĂ ªÀÄÄRågÀ¸ÉÛAiÀÄ°è AiÀÄÄ.f.r.¯ÉÊ£ï C¼ÀªÀr¸ÀÄªÀÅzÀÄ ªÀÄvÀÄÛ ZÉĂA§gÀ PÀlÄÖªÀÅzÀÄ. (EAqÉĂ£ïÖ £ÀA. 27156),Providing and Laying U.G.D. line and construction of chambers at M.R Nagar 2nd main Road in ward No. 8 of Dharwad.,16-Jul-15,199562,16-Jul-15,199562
42,2028,18-Jun-15,70800,13th Finance,13th Finance-2013-14(Bldg),Gadag Kushal C,ºÀÄ.«ªÁqÀđ £ÀA.47 ¯Áå«ÄAUÀl£ï ¸ÀÆ̀® PÀA¥ËAqÀ zÀÄgÀ¹Ü.,Improvements to Lamington School Compound at ward no 47,20-Jul-15,85622,20-Jul-15,85622
43,2900,16-Jul-15,71076,13th Finance,13th Finance-2014-15(UGD),Akki Prakash Gurubasappa,"EAqÉAmï £ÀA.27627, ºÀÄ.«.ªÁqÀđ £ÀA.63gÀ £ÀÆgÁ¤ ¥ÁèlzÀ°è G½zÀ ¨sÁUÀ, ²æĂgÁªÀÄ PÁ®¤, ¸ÀAvÉÆĂµÀ£ÀUÀgÀ ºÁUÀÆ CfäĂgÀ £ÀUÀgÀzÀ°è M¼ÀZÀgÀAr PÉÆ¼ÀªÉ ºÁPÀÄªÀzÀÄ.","Providing UGD line to Noorani plot remaining part, Shriram colony, Santosh nagar & Ajmir nagar at ward no. 63",20-Jul-15,871046,20-Jul-15,871046
44,2889,15-Jul-15,65066,13th Finance,13th Finance(P)2012-13(UGD),Jain M.M.,ºÀÄ.«.ªÁqÀđ £ÀA 48 gÀ UÁA¢üªÁqÁ ªÀÄÄSÉågÀ¸ÉÛ ¯Á®§zÀÆƯgÀ PÁ¯ÉÆĂ¤¬ÄAzÀ £Á¯ÁzÀªÀgÉUÉ M¼ÀZÀgÀAr PÉÆ¼ÀªÉ ºÁPÀÄªÀÅzÀÄ.,Regarding UGD Line work At Gandhi Wada Main Road Laal Bahaddhur Colony To Nala. in ward no 48,23-Jul-15,264250,24-Jul-15,264250
45,2860,14-Jul-15,71345,13th Finance,13th Finance(P)2013-14(UGD),Bhajantri Pandurang M,ºÀÄ.«ªÁqÀđ £ÀA.37gÀ UÉÆĂPÀÄ® UÁæªÀÄzÀ «ĂgÀ DAd£ÉĂAiÀÄ£ÀUÀgÀ ºÁUÀÆ vÁjºÁ¼À §¸ÀªÀ PÁ®¤AiÀÄ°è M¼ÀZÀgÀAr PÉÆ¼ÀªÉ C¼ÀªÀr¸ÀÄªÀÅzÀÄ.,Providing UGD line to Gokula Grama Veer Ajanayanagar and Tharihal Basav colony  at ward no. 37,23-Jul-15,557377,25-Jul-15,557377
46,2974,20-Jul-15,72437,13th Finance,13th Finance-2014-15(UGD),Doddamani R.M.,"EAqÉAmï £ÀA.27022,.ªÁ£ÀA.58, 59 & 57gÀ JZï.r.JA.¹ PÁél¸Àđ »A¨sÁUÀ¢AzÀ ¦.©. gÉÆĂqÀ ªÀgÉUÉ, §APÁ¥ÀÆgÀZËPÀ fUÀ®ÆgÀ ©°ØAUï »A¢£À CqÀØgÀ¸ÉÛUÀ¼À°è, ¸ÉÆĂ¤AiÀiÁUÁA¢ü £Á¯ÁªÀgÉUÉ, §¤ßªÀÄºÁAPÁ½, ¸ÀªÀÄÄzsÁAiÀÄ ¨sÀªÀ£À ªÀgÉUÉ M¼ÀZÀgÀAr PÉÆ¼ÀªÉ ºÁPÀÄªÀÅzÀÄ.","Providing UGD line to HDMC Quatres backside P.B road ward no. 58,59 & 57 Bankampur Jigalur bldg backside road",25-Jul-15,908228,29-Jul-15,908228
47,2879,15-Jul-15,72034,13th Finance,13th Finance(P)2012-13(UGD),Pattankari Basha Hajaratsab,"EAqÉAmï £ÀA. 15650, ºÀÄ.«. ªÁ. £ÀA. 53gÀ°è M¼ÀZÀgÀAr PÁªÀÄUÁj ºÁUÀÆ ºÁ° ±ËZÁ®AiÀÄzÀ M¼ÀZÀgÀAr zÀÄgÀ¹Ü",Improvement of under drainage & old toilets UGD.Line in ward No.53,25-Jul-15,619359,30-Jul-15,619359
48,2963,17-Jul-15,70888,13th Finance,13th Finance-2011-12(Bldg),Waddar Maruti G,"EAqÉAmï £ÀA.27606, ºÀÄ.«.ªÁqÀđ £ÀA 47 gÀ ªÀÄºÁ£ÀUÀgÀ ¥Á°PÉAiÀÄ PÁAiÀÄđ¥Á®PÀ C©üAiÀÄAvÀgÀÄ (GvÀÛgÀ) ºÁUÀÆ ªÁlgÀ ¨ÉÆĂqÀđ PÀZÉĂjAiÀÄ PÀlÖqÀUÀ¼À zÀÄgÀ¹Ü ªÀiÁqÀÄªÀzÀÄ.",Regarding Building work At HDMC (north) & water bord in ward no 47 Hubli Division (HDMC),29-Jul-15,131433,30-Jul-15,131433
49,2962,17-Jul-15,70895,13th Finance,13th Finance-2012-13(Bldg),Waddar Maruti G,"EAqÉAmï £ÀA.27625, ºÀÄ.«.ªÁqÀđ. £ÀA. 47gÀ ªÀÄºÁ£ÀUÀgÀ ¥Á°PÉAiÀÄ ¯Á-D¦üĂ¸ï, ¸ÁªÀiÁ£Àå DqÀ½vÀ ºÁUÀÆ D±ÀæAiÀÄ PÀZÉĂjAiÀÄ PÀlÖqÀUÀ¼À zÀÄgÀ¹Ü ªÀiÁqÀÄªÀÅzÀÄ.","Repairs to Office of Law office, GA branch and Ashrya section  at HDMC Premises at ward No 47",29-Jul-15,164612,30-Jul-15,164612
50,2861,14-Jul-15,71071,13th Finance,13th Finance-2014-15(Drain),Bepari .Aijaz Ahmed,"EAqÉAmï £ÀA.25697, ºÀÄ.«.ªÁqÀđ £ÀA. 52 s¹©n ªÀÄ¸ÀÆ¢ ºÀwÛgÀ ºÁUÀÆ UË½UÀ°èAiÀÄ°è vÉgÉzÀ ZÀgÀAr PÀlÄÖªÀzÀÄ.",Construction of RCC Open drain in CBT Masque and Near Golligalli  at ward no. 52.,29-Jul-15,761117,30-Jul-15,761117
51,3194,27-Jul-15,71154,13th Finance,13th Finance(P)2012-13(UGD),Bhajantri Pandurang M,"EAqÉAmï £ÀA.27580, ºÀÄ.«.ªÁqÀđ £ÀA 62 gÀ ¨Á£ÀwPÀmÁÖ PÁ¯ÉÆ¤AiÀÄ°è M¼ÀZÀgÀAr C¼ÀªÀr¸ÀÄªÀzÀÄ.",Regaring UGD Line work At  Banati Katta Colony. in ward no 62,03-Aug-15,596308,04-Aug-15,596308
52,3474,04-Aug-15,71504,13th Finance,13th Finance(P)2011-12(swm),Ray Engineers and Fabricators Belgaum,PÀA¥ÁåPÀÖgï PÀAmÉĂ£ÀgÀUÀ¼À£ÀÄß ¥ÀÆgÉÊPÉ ªÀiÁqÀÄªÀ PÀÄjvÀÄ. (£ÀA. 89),Supply of 1.1 Cum Compactor Container (89No),04-Aug-15,1920353,05-Aug-15,1920353
53,3195,27-Jul-15,70963,13th Finance,13th Finance(P)2012-13(Drain),Goudar Mohan G,"EAqÉAmï £ÀA.27583, ºÀÄ.«.ªÁqÀđ £ÀA 41 gÀ ºÉUÉÎĂj ¨sÀÄ£ÉĂ±Àéj £ÀUÀgÀzÀ°è ºÁUÀÄ ªÁqÀđ £ÀA 60 gÀ dAVè¥ÀKl gÀ¸ÉÛ §¸ÀªÀtÚzÉĂªÀgÀ UÀÄr¬ÄAzÀ §¸ÀªÉĂ±ÀégÀ ¸ÀPÀđ® PÀqÉUÉ Dgï.¹.¹. UÀmÁgÀ ¤«Äđ¸ÀÄªÀÅzÀÄ.","Regarding  RCC Drain work At Heggeri Bhuvaneshwari nagar & ward no 66 Janglipeth Road, Basavannadevar Temple To  Basaveshwar Circle. in ward no 41",03-Aug-15,930817,06-Aug-15,930817
54,3389,31-Jul-15,71444,13th Finance,13th Finance-2012-13(Electrical),Devagiri Electricals,ºÀÄ§â½î «¨sÁUÀzÀ  ªÁqÀđ £ÀA. 47 gÀ°è §gÀÄªÀ ¯Áå«ÄAUÀÖ£À gÀ¸ÉÛAiÀÄ°è£À «ÄĂrAiÀÄ£ÀzÀ°è ºÁ¼ÁzÀ PÉĂ§® §zÀ¯Á¬Ä¸ÀÄªÀÅzÀÄ.,Replacing damaged cable at Lamington road median of ward no. 47 Hubli division.,05-Aug-15,187695,06-Aug-15,187695
55,3376,30-Jul-15,70846,13th Finance,13th Finance-2014-15(UGD),Malagimani Ashok M,ºÀÄ.«.ªÁ.£ÀA.40gÀ UÀuÉĂ±À PÁ®¤AiÀÄ°è M¼ÀZÀgÀAr PÉÆ¼ÀªÉ ¯ÉÊ£ï ºÁPÀÄªÀÅzÀÄ.,Providing  U.G.D. line in Ganesha colony   at  ward no 40.,05-Aug-15,466884,06-Aug-15,466884
56,3489,05-Aug-15,70413,13th Finance,13th Finance-2012-13(Drain),Talikoti Ravi G,"EAqÉAmï £ÀA.27595, ºÀÄ.«.ªÁqÀđ £ÀA 58 gÀ ¸ÀÄzsÁ ºÉÆmÉ¯ï ¢AzÀ AiÀÄ¯Áè¥ÀÆgÀ NtÂ ªÀÄ¸ÀÆwªÀgÉUÉ Dgï.¹.¹. vÉgÉzÀ ZÀgÀAr ªÉÄĂ¯É ¸Áå¨ï ºÁPÀÄªÀzÀÄ.",Regarding RCC Drain work At Sudha Hotel To Yallapur Oni. in ward no 58,11-Aug-15,398634,11-Aug-15,398634
57,3388,31-Jul-15,71490,13th Finance,13th Finance-2014-15(Electrical),Annigeri Green Tech,"ºÀÄ§â½î «¨sÁUÀzÀ ªÁqÀđ £ÀA 63 gÀ°è §gÀÄªÀ zÀÄUÁđ ±ÀQÛ PÁ¯ÉÆĂ¤, ²AzsÉ ¥Áèl, ²ªÀ ±ÀQÛ PÁ¯ÉÆĂ¤AiÀÄ°è ©Ă¢¢Ă¥ÀUÀ¼À  eÁ®PÉ̀ «zÀÄåvï ¥ÀjªÀvÀđPÀ C¼ÀªÀr¸ÀÄªÀzÀÄ.","Erection of transformer for power connection to street lights at durga shakati colony, shinde plot, shivshakati colony of ward no. 63 Hubli division.",10-Aug-15,137705,11-Aug-15,137705
58,3476,04-Aug-15,66433,13th Finance,13th Finance(P)2012-13(swm),Green Nerds Solutions,7 l£ï ¸ÁªÀÄxÀåđzÀ UÀ§ÆâgÀ ¸ÉÊmï£À°è ¸ÀA¸À̀gÀt AiÀÄAvÀæ ¸ÁnđAUï UÁ¨ÉĂđeï C£ÀÄ¸ÁÜ¥À£ÀªÀ£ÀÄß ¥ÀÆgÉÊ¸ÀÄªÀ PÀÄjvÀÄ.,Supply & Installtion of Garbage Sorting Processing machine of 7 ton/day Capacity at Gabbur STP Site.,12-Aug-15,1184000,13-Aug-15,1184000
59,3524,06-Aug-15,71671,13th Finance,13th Finance-2013-14(UGD),Hanchin Deepak Mohan,"EAqÉAmï £ÀA.27032, ºÀÄ.«ªÁqÀđ £ÀA.50 ¨Áå½ ¥Áèl, ²Ă¯Á PÁ®¤ CgÀ½PÀnÖ NtÂ 2£ÉĂ PÁæ¸ÀzÀ°è M¼ÀZÀgÀAr PÉÆ¼ÀªÉ ºÁPÀÄªÀzÀÄ.","Providing UGD line to Byali Plot, Shila Colony Aralikatti oni 2nd cross at ward no 50.",13-Aug-15,337943,13-Aug-15,337943
60,3539,06-Aug-15,71098,13th Finance,13th Finance-2014-15(Drain),Talikoti Ravi G,"EAqÉAmï £ÀA.26993, ºÀÄ.«.ªÁqÀđ £ÀA.55gÀ ²A¦UÀ°è PÁæ¸À¢AzÀ UÀ§ÆâgÀUÀ°è PÁæ¸ïªÀgÉUÉ, ªÁqÀđ £ÀA.57gÀ ±ÁAw¤PÉĂvÀ£ 1£ÉĂ ªÀÄÄRå gÀ¸ÉÛAiÀÄ°è Dgï.¹.¹ UÀmÁgÀ ¤«Äđ¸ÀÄªÀzÀÄ ºÁUÀÆ ªÁqÀđ £ÀA.58gÀ UÀ§ÆâgÀUÀ°è¬ÄAzÀ ²æĂ±ÉÊ® ªÀÄoÀzÀªÀgÉUÉ Dgï.¹.¹ UÀmÁgÀ ¤«Äđ¹ ¸Áèöå¨ï ºÁPÀÄªÀzÀÄ.","Construction of RCC Open drain in Shimpi galli cross to Gabbur galli cross at ward no. 55, Shantinikatan colony at ward no. 57 & Construction of Drain & Providing slab in Gabbur galli to Shrisail matha  at ward no. 58",13-Aug-15,1163088,13-Aug-15,1163088
